<?xml version="1.0" encoding="utf-8"?>
<!DOCTYPE Character_Description SYSTEM "../DTDs/Character_Description.dtd">
<Character_Description>
	<Character_Type>Player</Character_Type>
	<Characters_ID>Humanoid</Characters_ID>
	<Data_Root_Directory>Data/Characters/</Data_Root_Directory>
	<Coords>
		<Initial_Position_X>192</Initial_Position_X>
		<Initial_Position_Y>224</Initial_Position_Y>
	</Coords>
	<Default_Sprite>
		<Default_Sprite_Width>96</Default_Sprite_Width>
		<Default_Sprite_Height>96</Default_Sprite_Height>
	</Default_Sprite>
	<Default_Collision_Box>
		<X_Modifier>+33</X_Modifier>
		<Y_Modifier>+20</Y_Modifier>
		<CB_Width>34</CB_Width>
		<CB_Height>59</CB_Height>
	</Default_Collision_Box>

	<Characteristics>
		<Velocity>120</Velocity><!-- Eceptionnaly it's in px/s coz its the player-->
		<Life>100</Life>
		<Armor>0</Armor>
		<Damage>20</Damage>
	</Characteristics>
	<Default_Animations>
		<Animation_Center_Filename>Human_Unarmed_Animations.xml</Animation_Center_Filename>
	</Default_Animations>
</Character_Description>
