<?xml version="1.0" encoding="utf-8"?>
<!DOCTYPE Character_Description SYSTEM "../DTDs/Character_Description.dtd">
<Character_Description>
	<Character_Type>NPC</Character_Type>
	<Data_Root_Directory>Data/Characters/</Data_Root_Directory>
	<Coords>
		<Initial_Position_X>1088</Initial_Position_X>
		<Initial_Position_Y>352</Initial_Position_Y>
	</Coords>
	<Allowed_Area> <!-- Only allowed inside city walls -->
		<Allowed_Area_X>1056</Allowed_Area_X>
		<Allowed_Area_Y>320</Allowed_Area_Y>
		<Allowed_Area_W>160</Allowed_Area_W>
		<Allowed_Area_H>288</Allowed_Area_H>
	</Allowed_Area>
	<Default_Sprite>
		<Default_Sprite_Width>96</Default_Sprite_Width>
		<Default_Sprite_Height>96</Default_Sprite_Height>
	</Default_Sprite>
	<Default_Collision_Box>
		<X_Modifier>0</X_Modifier>
		<Y_Modifier>0</Y_Modifier>
		<CB_Width>96</CB_Width>
		<CB_Height>96</CB_Height>
	</Default_Collision_Box>

	<Characteristics>
		<Velocity>2</Velocity>
		<Life>100</Life>
		<Armor>0</Armor>
		<Damage>100</Damage>
	</Characteristics>
	<Default_Animations>
		<Animation_Center_Filename>Merchant_Animations.xml</Animation_Center_Filename>
	</Default_Animations>
</Character_Description>
